{
  "type": "symbol",
  "name": "vdd",
  "library": "skywater_primitives",
  "prefix": "",
  "spice_model": "VDD",
  "pins": [
    {
      "name": "VDD",
      "x": 0,
      "y": 10,
      "direction": "inout",
      "net_name": "VDD"
    }
  ],
  "shapes": [
    {
      "type": "line",
      "x1": -12,
      "y1": 0,
      "x2": 12,
      "y2": 0
    },
    {
      "type": "line",
      "x1": 0,
      "y1": 10,
      "x2": 0,
      "y2": 0
    }
  ],
  "parameters": [],
  "label": {
    "text": "VDD",
    "x": 0,
    "y": 15
  }
}