{
  "type": "symbol",
  "name": "sg13_hv_rf_pmos",
  "library": "ihp_primitives",
  "prefix": "M",
  "spice_model": "sg13_hv_rf_pmos",
  "pins": [
    {
      "name": "D",
      "x": 20,
      "y": 30,
      "direction": "inout"
    },
    {
      "name": "G",
      "x": -20,
      "y": 0,
      "direction": "input"
    },
    {
      "name": "S",
      "x": 20,
      "y": -30,
      "direction": "inout"
    },
    {
      "name": "B",
      "x": 20,
      "y": 0,
      "direction": "inout"
    }
  ],
  "shapes": [
    {
      "type": "line",
      "x1": 7.5,
      "y1": -22.5,
      "x2": 7.5,
      "y2": 22.5
    },
    {
      "type": "line",
      "x1": -20,
      "y1": 0,
      "x2": 2,
      "y2": 0
    },
    {
      "type": "line",
      "x1": 20,
      "y1": 30,
      "x2": 20,
      "y2": 17.5
    },
    {
      "type": "line",
      "x1": 20,
      "y1": -30,
      "x2": 20,
      "y2": -17.5
    },
    {
      "type": "line",
      "x1": 2.5,
      "y1": -15,
      "x2": 2.5,
      "y2": 15
    },
    {
      "type": "line",
      "x1": 7.5,
      "y1": 17.5,
      "x2": 20,
      "y2": 17.5
    },
    {
      "type": "line",
      "x1": 7.5,
      "y1": -17.5,
      "x2": 20,
      "y2": -17.5
    },
    {
      "type": "polygon",
      "points": [
        [
          12.5,
          -20
        ],
        [
          7.5,
          -17.5
        ],
        [
          12.5,
          -15
        ]
      ]
    },
    {
      "type": "polygon",
      "points": [
        [
          15,
          0
        ],
        [
          20,
          2.5
        ],
        [
          15,
          -2.5
        ]
      ]
    }
  ],
  "parameters": [
    {
      "name": "w",
      "default": "0.15u",
      "description": "Width"
    },
    {
      "name": "l",
      "default": "0.13u",
      "description": "Length"
    },
    {
      "name": "ng",
      "default": "1",
      "description": "Number of gate fingers"
    },
    {
      "name": "m",
      "default": "1",
      "description": "Multiplier"
    }
  ],
  "label": {
    "text": "@name",
    "x": 5,
    "y": -30
  }
}