{
  "type": "symbol",
  "name": "pmos",
  "library": "skywater_primitives",
  "prefix": "M",
  "spice_model": "pfet_01v8",
  "pins": [
    {
      "name": "D",
      "x": 20,
      "y": 30,
      "direction": "inout"
    },
    {
      "name": "G",
      "x": -20,
      "y": 0,
      "direction": "input"
    },
    {
      "name": "S",
      "x": 20,
      "y": -30,
      "direction": "inout"
    },
    {
      "name": "B",
      "x": 20,
      "y": 0,
      "direction": "inout"
    }
  ],
  "shapes": [
    {
      "type": "line",
      "x1": 7.5,
      "y1": -22.5,
      "x2": 7.5,
      "y2": 22.5
    },
    {
      "type": "line",
      "x1": 20,
      "y1": 30,
      "x2": 20,
      "y2": 17.5
    },
    {
      "type": "line",
      "x1": 20,
      "y1": -30,
      "x2": 20,
      "y2": -17.5
    },
    {
      "type": "line",
      "x1": 2.5,
      "y1": -15,
      "x2": 2.5,
      "y2": 15
    },
    {
      "type": "line",
      "x1": 7.5,
      "y1": -17.5,
      "x2": 12.5,
      "y2": -17.5
    },
    {
      "type": "line",
      "x1": 7.5,
      "y1": 17.5,
      "x2": 20,
      "y2": 17.5
    },
    {
      "type": "line",
      "x1": -20,
      "y1": 0,
      "x2": -7.5,
      "y2": 0
    },
    {
      "type": "circle",
      "cx": -2.5,
      "cy": 0,
      "r": 5
    },
    {
      "type": "polygon",
      "points": [
        [
          12.5,
          -20
        ],
        [
          7.5,
          -17.5
        ],
        [
          12.5,
          -15
        ]
      ]
    },
    {
      "type": "polygon",
      "points": [
        [
          15,
          -2.5
        ],
        [
          20,
          0
        ],
        [
          15,
          2.5
        ]
      ]
    }
  ],
  "parameters": [
    {
      "name": "W",
      "default": "1",
      "description": "Width (um)"
    },
    {
      "name": "L",
      "default": "0.15",
      "description": "Length (um)"
    },
    {
      "name": "nf",
      "default": "1",
      "description": "Number of fingers"
    },
    {
      "name": "mult",
      "default": "1",
      "description": "Multiplier"
    },
    {
      "name": "ad",
      "default": "",
      "description": "Drain area"
    },
    {
      "name": "as",
      "default": "",
      "description": "Source area"
    },
    {
      "name": "pd",
      "default": "",
      "description": "Drain perimeter"
    },
    {
      "name": "ps",
      "default": "",
      "description": "Source perimeter"
    },
    {
      "name": "nrd",
      "default": "",
      "description": "Drain resistance squares"
    },
    {
      "name": "nrs",
      "default": "",
      "description": "Source resistance squares"
    }
  ],
  "label": {
    "text": "@name",
    "x": 5,
    "y": -30
  }
}