{
  "type": "symbol",
  "name": "gnd",
  "library": "skywater_primitives",
  "prefix": "",
  "spice_model": "0",
  "pins": [
    {
      "name": "GND",
      "x": 0,
      "y": -10,
      "direction": "inout",
      "net_name": "0"
    }
  ],
  "shapes": [
    {
      "type": "line",
      "x1": 0,
      "y1": -10,
      "x2": 0,
      "y2": 0
    },
    {
      "type": "line",
      "x1": -12,
      "y1": 0,
      "x2": 12,
      "y2": 0
    },
    {
      "type": "line",
      "x1": -8,
      "y1": 5,
      "x2": 8,
      "y2": 5
    },
    {
      "type": "line",
      "x1": -4,
      "y1": 10,
      "x2": 4,
      "y2": 10
    }
  ],
  "parameters": [],
  "label": {
    "text": "GND",
    "x": 0,
    "y": -15
  }
}