{
  "type": "symbol",
  "name": "corner",
  "library": "imported",
  "prefix": "X",
  "spice_model": "corner",
  "pins": [],
  "shapes": [
    {
      "type": "line",
      "x1": 20.0,
      "y1": 30.0,
      "x2": 60.0,
      "y2": 30.0
    },
    {
      "type": "line",
      "x1": 20.0,
      "y1": 40.0,
      "x2": 40.0,
      "y2": 40.0
    },
    {
      "type": "line",
      "x1": 20.0,
      "y1": 50.0,
      "x2": 60.0,
      "y2": 50.0
    },
    {
      "type": "line",
      "x1": 20.0,
      "y1": 60.0,
      "x2": 50.0,
      "y2": 60.0
    },
    {
      "type": "line",
      "x1": 20.0,
      "y1": 70.0,
      "x2": 50.0,
      "y2": 70.0
    },
    {
      "type": "line",
      "x1": 20.0,
      "y1": 80.0,
      "x2": 90.0,
      "y2": 80.0
    },
    {
      "type": "line",
      "x1": 20.0,
      "y1": 90.0,
      "x2": 40.0,
      "y2": 90.0
    },
    {
      "type": "line",
      "x1": 20.0,
      "y1": 20.0,
      "x2": 70.0,
      "y2": 20.0
    },
    {
      "type": "line",
      "x1": 20.0,
      "y1": 10.0,
      "x2": 40.0,
      "y2": 10.0
    },
    {
      "type": "line",
      "x1": 100.0,
      "y1": 10.0,
      "x2": 110.0,
      "y2": 10.0
    },
    {
      "type": "line",
      "x1": 110.0,
      "y1": 10.0,
      "x2": 110.0,
      "y2": 110.0
    },
    {
      "type": "line",
      "x1": 20.0,
      "y1": 110.0,
      "x2": 110.0,
      "y2": 110.0
    },
    {
      "type": "line",
      "x1": 20.0,
      "y1": 100.0,
      "x2": 20.0,
      "y2": 110.0
    },
    {
      "type": "line",
      "x1": 100.0,
      "y1": 0.0,
      "x2": 100.0,
      "y2": 100.0
    },
    {
      "type": "line",
      "x1": 10.0,
      "y1": 100.0,
      "x2": 100.0,
      "y2": 100.0
    },
    {
      "type": "line",
      "x1": 10.0,
      "y1": 0.0,
      "x2": 10.0,
      "y2": 100.0
    },
    {
      "type": "line",
      "x1": 10.0,
      "y1": 0.0,
      "x2": 100.0,
      "y2": 0.0
    }
  ],
  "parameters": []
}