{
  "type": "symbol",
  "name": "diode",
  "library": "gf180mcu_primitives",
  "prefix": "D",
  "spice_model": "diode",
  "pins": [
    {
      "name": "ANODE",
      "x": 0,
      "y": -30,
      "direction": "inout"
    },
    {
      "name": "CATHODE",
      "x": 0,
      "y": 30,
      "direction": "inout"
    }
  ],
  "shapes": [
    {
      "type": "line",
      "x1": 0,
      "y1": -30,
      "x2": 0,
      "y2": -5
    },
    {
      "type": "line",
      "x1": 0,
      "y1": 5,
      "x2": 0,
      "y2": 30
    },
    {
      "type": "polygon",
      "points": [
        [
          0,
          -5
        ],
        [
          10,
          5
        ],
        [
          -10,
          5
        ]
      ]
    },
    {
      "type": "line",
      "x1": -10,
      "y1": -5,
      "x2": -10,
      "y2": 5
    }
  ],
  "parameters": [
    {
      "name": "area",
      "default": "1",
      "description": "Area multiplier"
    }
  ],
  "label": {
    "text": "@name",
    "x": 15,
    "y": 0
  }
}